{
  "schema_version": "1.0",
  "case_id": "pushkin-last-duel",
  "title": "Пушкин: придворные интриги и последняя дуэль, 1833–1837",
  "scope": "Расширенный документальный корпус: тексты писем, дневника, научные комментарии и хронологический справочник. Описание чужого обвинения НЕ означает доказательство обвиняемого действия.",
  "entities": [
    {
      "id": "pushkin",
      "name": "Александр Пушкин",
      "kind": "person",
      "aliases": []
    },
    {
      "id": "natalia",
      "name": "Наталья Гончарова-Пушкина",
      "kind": "person",
      "aliases": []
    },
    {
      "id": "dantes",
      "name": "Жорж Дантес",
      "kind": "person",
      "aliases": []
    },
    {
      "id": "ekaterina",
      "name": "Екатерина Гончарова",
      "kind": "person",
      "aliases": []
    },
    {
      "id": "heckern",
      "name": "Луи Геккерн",
      "kind": "person",
      "aliases": []
    },
    {
      "id": "nicholas1",
      "name": "Николай I",
      "kind": "person",
      "aliases": []
    },
    {
      "id": "idalia",
      "name": "Идалия Полетика",
      "kind": "person",
      "aliases": []
    },
    {
      "id": "lermontov",
      "name": "Михаил Лермонтов",
      "kind": "person",
      "aliases": []
    },
    {
      "id": "dolgorukov",
      "name": "Пётр Долгоруков",
      "kind": "person",
      "aliases": []
    },
    {
      "id": "uvarov",
      "name": "Сергей Уваров",
      "kind": "person",
      "aliases": []
    },
    {
      "id": "benckendorff",
      "name": "Александр Бенкендорф",
      "kind": "person",
      "aliases": []
    },
    {
      "id": "sollogub",
      "name": "Владимир Соллогуб",
      "kind": "person",
      "aliases": []
    },
    {
      "id": "repnin",
      "name": "Николай Репнин-Волконский",
      "kind": "person",
      "aliases": []
    },
    {
      "id": "bogolubov",
      "name": "Варфоломей Боголюбов",
      "kind": "person",
      "aliases": []
    },
    {
      "id": "saveliev",
      "name": "Пётр Савельев",
      "kind": "person",
      "aliases": []
    },
    {
      "id": "grinvald",
      "name": "Гринвальд (командир кавалергардов)",
      "kind": "person",
      "aliases": []
    },
    {
      "id": "archiac",
      "name": "Оливье д’Аршиак",
      "kind": "person",
      "aliases": []
    },
    {
      "id": "zhukovsky",
      "name": "Василий Жуковский",
      "kind": "person",
      "aliases": []
    },
    {
      "id": "sheremetev",
      "name": "Дмитрий Шереметев",
      "kind": "person",
      "aliases": []
    },
    {
      "id": "danzas",
      "name": "Константин Данзас",
      "kind": "person",
      "aliases": []
    }
  ],
  "sources": [
    {
      "id": "src-letter-1836",
      "title": "Пушкин → Бенкендорфу, 21 ноября 1836",
      "type": "primary",
      "locator": "https://rvb.ru/pushkin/01text/10letters/1831_37/01text/1836/1937_749.htm",
      "created": {
        "year": 1836,
        "month": 12,
        "day": 3
      },
      "derived_from": [],
      "note": "Критически опубликованное письмо: свидетельствует о заявлении Пушкина, а не об истинности каждого обвинения"
    },
    {
      "id": "src-letter-1837",
      "title": "Пушкин → Геккерну, 26 января 1837",
      "type": "primary",
      "locator": "https://rvb.ru/pushkin/01text/10letters/1831_37/01text/1837/1967_779.htm",
      "created": {
        "year": 1837,
        "month": 2,
        "day": 7
      },
      "derived_from": [],
      "note": "Современная электронная публикация первичного письма"
    },
    {
      "id": "src-chronology",
      "title": "М. А. Цявловский: хронологическая канва биографии А. С. Пушкина",
      "type": "secondary",
      "locator": "https://rvb.ru/pushkin/bio/pushkin-hronology.htm",
      "created": null,
      "derived_from": [],
      "note": "Вторичный хронологический справочник; не считать независимым подтверждением включённых в него первичных источников"
    },
    {
      "id": "src-comment",
      "title": "И. М. Семенко: комментарий к письму Бенкендорфу",
      "type": "secondary",
      "locator": "https://rvb.ru/pushkin/02comm/1937_749.htm",
      "created": null,
      "derived_from": [
        "src-letter-1836"
      ],
      "note": "Прямо опирается на письмо; не является независимым свидетелем содержания письма"
    },
    {
      "id": "src-wife-oct11",
      "title": "Пушкин → Н. Н. Пушкиной, 11 октября 1833",
      "type": "primary",
      "locator": "https://rvb.ru/pushkin/01text/10letters/1831_37/01text/1833/1724_536.htm",
      "created": {
        "year": 1833,
        "month": 10,
        "day": 23
      },
      "derived_from": [],
      "note": "Упоминание царя отражает выражение Пушкина, а не доказанный роман."
    },
    {
      "id": "src-wife-oct30",
      "title": "Пушкин → Н. Н. Пушкиной, 30 октября 1833",
      "type": "primary",
      "locator": "https://rvb.ru/pushkin/01text/10letters/1831_37/01text/1833/1726_538.htm",
      "created": {
        "year": 1833,
        "month": 11,
        "day": 11
      },
      "derived_from": [],
      "note": "Открытое приветствие Полетике, переданное через жену."
    },
    {
      "id": "src-diary-1834",
      "title": "Пушкин: дневниковая запись, 1 января 1834",
      "type": "primary",
      "locator": "https://rvb.ru/pushkin/01text/08history/03memoires/1160.htm",
      "created": {
        "year": 1834,
        "month": 1,
        "day": 13
      },
      "derived_from": [],
      "note": "Личная оценка причины назначения камер-юнкером."
    },
    {
      "id": "src-lucullus-poem",
      "title": "Пушкин: «На выздоровление Лукулла», 1835",
      "type": "primary",
      "locator": "https://rvb.ru/pushkin/01text/01versus/0423_36/1835/0607.htm",
      "created": null,
      "derived_from": [],
      "note": "Стихотворение не именует Уварова непосредственно."
    },
    {
      "id": "src-lucullus-annotation",
      "title": "Т. Г. Цявловская: комментарий к «Лукуллу»",
      "type": "secondary",
      "locator": "https://rvb.ru/pushkin/02comm/0607.htm",
      "created": null,
      "derived_from": [
        "src-lucullus-poem"
      ],
      "note": "Идентификация Уварова — интерпретация современников, описанная в комментарии."
    },
    {
      "id": "src-repnin-letter",
      "title": "Пушкин → Н. Г. Репнину, 5 февраля 1836",
      "type": "primary",
      "locator": "https://rvb.ru/pushkin/01text/10letters/1831_37/01text/1836/1872_684.htm",
      "created": {
        "year": 1836,
        "month": 2,
        "day": 17
      },
      "derived_from": [],
      "note": "Подтверждает сообщение Пушкина о слухе, не подтверждает слова Репнина."
    },
    {
      "id": "src-repnin-reply",
      "title": "Пушкин → Н. Г. Репнину, 11 февраля 1836",
      "type": "primary",
      "locator": "https://rvb.ru/pushkin/01text/10letters/1831_37/01text/1836/1874_686.htm",
      "created": {
        "year": 1836,
        "month": 2,
        "day": 23
      },
      "derived_from": [],
      "note": "Свидетельство о состоявшемся ответе Репнина и примирительном тоне Пушкина."
    },
    {
      "id": "src-repnin-annotation",
      "title": "И. М. Семенко: комментарий к переписке с Репниным",
      "type": "secondary",
      "locator": "https://rvb.ru/pushkin/02comm/1872_684.htm",
      "created": null,
      "derived_from": [
        "src-repnin-letter"
      ],
      "note": "Боголюбов связывается с Уваровым; не независимое свидетельство самой речи Репнина."
    },
    {
      "id": "src-idalia-may",
      "title": "Пушкин → Н. Н. Пушкиной, 6 мая 1836",
      "type": "primary",
      "locator": "https://rvb.ru/pushkin/01text/10letters/1831_37/01text/1836/1897_709.htm",
      "created": {
        "year": 1836,
        "month": 5,
        "day": 18
      },
      "derived_from": [],
      "note": "Сообщает о московских слухах про Идалию и Савельева; не свидетельство о реальной пощёчине."
    },
    {
      "id": "src-heckern-draft",
      "title": "Пушкин → Л. Геккерну, проект письма 17–21 ноября 1836",
      "type": "primary",
      "locator": "https://rvb.ru/pushkin/01text/10letters/1831_37/01text/1836/1936_748.htm",
      "created": null,
      "derived_from": [],
      "note": "Черновой/неотправленный текст с диапазоном дат; нельзя трактовать как вручённое письмо."
    },
    {
      "id": "src-heckern-reply",
      "title": "Геккерн → Пушкину, с пометой Дантеса, 26 января 1837",
      "type": "primary",
      "locator": "https://as-pushkin.net/pushkin/pisma/pushkinu-1363.php",
      "created": {
        "year": 1837,
        "month": 2,
        "day": 7
      },
      "derived_from": [],
      "note": "По опубликованному подлиннику военно-судного дела; ответный вызов и одобрение Дантеса."
    },
    {
      "id": "src-archiac-jan27",
      "title": "Пушкин → д’Аршиаку, 27 января 1837",
      "type": "primary",
      "locator": "https://www.as-pushkin.net/pushkin/pisma/785.htm",
      "created": {
        "year": 1837,
        "month": 2,
        "day": 8
      },
      "derived_from": [],
      "note": "Отказ от дальнейших переговоров; подтверждает позицию поэта, а не организованный заговор."
    },
    {
      "id": "src-lermontov-comment",
      "title": "Научный комментарий к «Смерти поэта» Лермонтова",
      "type": "secondary",
      "locator": "https://rvb.ru/19vek/lermontov/ss4/vol1/notes/334.html",
      "created": null,
      "derived_from": [],
      "note": "Издания, списки текста, варианты датировок и судьба обвинительных строк."
    },
    {
      "id": "src-prlib-duel",
      "title": "Президентская библиотека: «Нет, весь я не умру...»",
      "type": "secondary",
      "locator": "https://www.prlib.ru/news/1330708",
      "created": null,
      "derived_from": [],
      "note": "Обзор архивных документов и хронологии последних дней; вторичный источник."
    }
  ],
  "claims": [
    {
      "id": "claim-received",
      "text": "Пушкин сообщил, что утром 4 ноября получил три экземпляра оскорбительного анонимного письма.",